{
  "schema_version": "1.0",
  "description": "提示词增强内部模板数据（机器规格）——步骤 3.1 提示词结构模板的段落定义与取值来源。仅供 LLM 内部规划使用，不直接对外输出；填写流程与重写规则保留在 SKILL.md（规则性内容）。按需读取。",
  "header": "## 第X章「{章名}」写作提示词",
  "sections": [
    {
      "id": "location",
      "title": "章节定位",
      "content": "- 所属阶段：{步骤 0 项目信息 → 分卷名}\n- 篇幅预期：{约多少字}\n- 核心事件：{步骤 1 大纲描述 → 一句提炼}\n- 内容分级：{步骤 2.4 → 一般向 / NSFW — N?档}",
      "source": "步骤 0 项目信息 / 步骤 1 大纲描述 / 步骤 2.4 NSFW"
    },
    {
      "id": "plot_points",
      "title": "剧情要点",
      "content": "{步骤 1 大纲原始描述 + 步骤 2.1 人物行为边界与对话风格 + 步骤 2.4 NSFW 融入（如触发）}\n{扩充为具体剧情要点，每条含：场景+人物行动+情绪走向}",
      "source": "步骤 1 / 步骤 2.1 / 步骤 2.4"
    },
    {
      "id": "direction",
      "title": "剧情走向",
      "content": "{从剧情要点中解析，按时间线或逻辑顺序编排章节的剧情走向}",
      "source": "内部推导（剧情要点解析）"
    },
    {
      "id": "foreshadowing",
      "title": "伏笔指令",
      "content": "{如有需放置的伏笔}\n- 本章需埋设：{步骤 2.3 → 需埋设清单}\n{如有需回收的伏笔}\n- 本章需回收：{步骤 2.3 → 需回收清单}",
      "source": "步骤 2.3 伏笔注入"
    },
    {
      "id": "scene",
      "title": "场景与氛围",
      "content": "{步骤 2.2 → 场景约束}\n{氛围关键词：3-5个——如\"紧张/暗流涌动/暴雨将至\"\"温馨/隐忧/黄昏光\"}",
      "source": "步骤 2.2 设定注入"
    },
    {
      "id": "sensory",
      "title": "感官细节方向",
      "content": "{步骤 2.5 → 从场景反推——本章以哪个感官通道切入（视觉/听觉/触觉/嗅觉/味觉），各情绪节点的感官优先级}\n{感官轮换提示：同一特征跨段落/跨章节轮换感官通道，避免感官单一}",
      "source": "步骤 2.5 感官注入"
    },
    {
      "id": "bridge",
      "title": "前情衔接",
      "content": "{上一章的结束状态，本章从何处接续}",
      "source": "步骤 0 上下文预读取"
    }
  ]
}
